AuthorID,Author,Date,Content,Attachments,Reactions
333909848762744832,potiii,2024-06-28T22:12:53.1570000+01:00,I just want a mini pro 😭,,
333909848762744832,potiii,2024-06-28T22:13:00.0710000+01:00,But there os no such thing,,
333909848762744832,potiii,2024-06-28T22:13:10.6790000+01:00,So i always buy the 11inch one,,
721686599317979136,marlow925,2024-06-28T22:13:15.4140000+01:00,i mean .. even if the next Mini has a M1 or M2 .. it'll be a beast.,,
333909848762744832,potiii,2024-06-28T22:14:00.9420000+01:00,But the screen … it really deepends on the color accuracy if i wanna use it as a monitor replacement for some giga,,
333909848762744832,potiii,2024-06-28T22:14:02.8310000+01:00,Gigs,,
721686599317979136,marlow925,2024-06-28T22:14:17.4880000+01:00,well .. gotta love iPad Pros for that ..,,
721686599317979136,marlow925,2024-06-28T22:14:29.6070000+01:00,and here's another issue .. that Accsoon Powercage .. does not exist for the Mini,,
721686599317979136,marlow925,2024-06-28T22:14:34.6530000+01:00,only iPad Air and Pro.,,
200574165843968001,beepbeepshengcai,2024-06-28T22:15:39.5670000+01:00,DIY cage go,,
721686599317979136,marlow925,2024-06-28T22:16:05.6520000+01:00,"yes .. there is now .. for the iPhone 15 Pro and Pro Max.
 The Atomos Ninja Phone",,
333909848762744832,potiii,2024-06-28T22:16:20.3260000+01:00,Im sure if they IF they make a mini w M series chips,,
333909848762744832,potiii,2024-06-28T22:16:25.3570000+01:00,There will be a powercage for it,,
721686599317979136,marlow925,2024-06-28T22:16:36.9400000+01:00,"i would say so, yes.",,
721686599317979136,marlow925,2024-06-28T22:17:12.1520000+01:00,lots of cases for iPads .. nothing quite as beefy as that one.,,
333909848762744832,potiii,2024-06-28T22:17:35.8800000+01:00,"That is cooolll i guess if u have an iphone 15 pro max, but the max is too big for me for a daily use",,
333909848762744832,potiii,2024-06-28T22:18:02.0260000+01:00,And it would be way more expensive than a good on cam monitor just to buy a max for monitoring alongside the 15 pro thst i use daily,,
333909848762744832,potiii,2024-06-28T22:18:13.4140000+01:00,And the normal 15 pro is small for an on cam monitor imo,,
721686599317979136,marlow925,2024-06-28T22:18:22.7550000+01:00,heehe .. can't have it all,,
333909848762744832,potiii,2024-06-28T22:18:29.1130000+01:00,Yup 😭,,
721686599317979136,marlow925,2024-06-28T22:18:32.0100000+01:00,I'm on a Samsung Note 20 Ultra for my daily,,
721686599317979136,marlow925,2024-06-28T22:18:42.9080000+01:00,"and that's slightly bigger than an iPhone 14 Pro Max, i have for testing",,
721686599317979136,marlow925,2024-06-28T22:19:09.1790000+01:00,"so, I wouldn't mind, but i've not quite seen the need, as i have way too many monitors as is.",,
333909848762744832,potiii,2024-06-28T22:19:09.2880000+01:00,"Thats also quite good, i switched from the 14 to the 15 just because of the usb c and pro res log…",,
721686599317979136,marlow925,2024-06-28T22:19:35.1810000+01:00,you already have Pro Res log in the 14.,,
333909848762744832,potiii,2024-06-28T22:19:47.4650000+01:00,"Usually i dont switch phones every year , just in 3-4 years time",,
333909848762744832,potiii,2024-06-28T22:19:51.6460000+01:00,What?,,
333909848762744832,potiii,2024-06-28T22:20:08.2160000+01:00,Lemme double check that,,
333909848762744832,potiii,2024-06-28T22:20:44.4280000+01:00,Ye but u cant record to SSDs externaly no?,,
721686599317979136,marlow925,2024-06-28T22:20:59.6690000+01:00,"Blackmagic Camera on my iPhone 14 Pro Max has Apple ProRes 422 HQ, 422, 422 LT etc.",,
333909848762744832,potiii,2024-06-28T22:21:00.3950000+01:00,And ig was only 30 fps ?,,
721686599317979136,marlow925,2024-06-28T22:21:04.8650000+01:00,unlikely,,
333909848762744832,potiii,2024-06-28T22:21:09.4460000+01:00,Hmmm,,
333909848762744832,potiii,2024-06-28T22:21:23.6940000+01:00,Than iv scammed myself w ignorance,,
721686599317979136,marlow925,2024-06-28T22:21:43.7160000+01:00,You have,,
721686599317979136,marlow925,2024-06-28T22:21:52.9690000+01:00,FilMic Legacy,,
333909848762744832,potiii,2024-06-28T22:21:59.0980000+01:00,"Just because its usb C , its still worth for my sanity",,
721686599317979136,marlow925,2024-06-28T22:22:01.1220000+01:00,4k ProRes 422 4k 60 fps,,
333909848762744832,potiii,2024-06-28T22:22:12.2070000+01:00,Ye i can see that now 😭,,
721686599317979136,marlow925,2024-06-28T22:22:13.5420000+01:00,but there are lots of advantages having USB-C,,
333909848762744832,potiii,2024-06-28T22:22:37.4340000+01:00,"Im not looking to rig up my phone tho , just nice to have these features",,
721686599317979136,marlow925,2024-06-28T22:22:51.0720000+01:00,as you said ..external harddrive,,
721686599317979136,marlow925,2024-06-28T22:22:53.9510000+01:00,using USB-C hubs,,
721686599317979136,marlow925,2024-06-28T22:22:56.7480000+01:00,access to more gear,,
333909848762744832,potiii,2024-06-28T22:23:22.4500000+01:00,"But.l. There is one thing that i would really like to get.l a beastgrip DOf adapter , but its ALWAYS SOLD OUT",,
721686599317979136,marlow925,2024-06-28T22:23:31.6430000+01:00,"here's the stupid thing on the iPad ... I bought the 2022 M2 11"" 10 days before Apple launched the M4 ones",,😭 (4)
721686599317979136,marlow925,2024-06-28T22:23:42.2070000+01:00,So i returned it .. full refund .. and bought the new one,,
721686599317979136,marlow925,2024-06-28T22:23:45.4820000+01:00,no questions asked,,
721686599317979136,marlow925,2024-06-28T22:23:50.7220000+01:00,the difference was .. 30 EUR !!,,
721686599317979136,marlow925,2024-06-28T22:23:55.2700000+01:00,for the same spec,,
333909848762744832,potiii,2024-06-28T22:24:10.7040000+01:00,"U got lucky , u were in the 14 days return window just by a hairstring",,
721686599317979136,marlow925,2024-06-28T22:24:16.2590000+01:00,yep,,
721686599317979136,marlow925,2024-06-28T22:24:55.4680000+01:00,"lad in Apple asked me, why I was returning it .. i asked him: do you know what happened yesterday ?
 He goes: ""Oh .. well .. we're collecting that one tomorrow""",,
721686599317979136,marlow925,2024-06-28T22:25:16.6780000+01:00,I got the new one 3 days after shipping officially started.,,
721686599317979136,marlow925,2024-06-28T22:25:33.3880000+01:00,refund was processed the day before shipping started,,
721686599317979136,marlow925,2024-06-28T22:26:32.0550000+01:00,i was upgrading from an iPad Mini 5th gen (last one with lightning). So big step up. Well worth it.,,
333909848762744832,potiii,2024-06-28T22:27:58.1400000+01:00,"Nice, they are soo quick w the refunds ,and exchanges, when i bought an ipad and it had some sort of screen issue , a red line was on the screen they go like “ look joe , a red line is on the screen”
 

 “Take it into the back , ill take a look “
 

 5 min passes
 

 “Yeah , there is a red line “
 

 pulls out a new one and hands it to me",,
721686599317979136,marlow925,2024-06-28T22:28:55.7340000+01:00,"gets worse in my case .. nearest Apple store would be over 100 km away, so i ordered online, booked return online .. was supposed to get a call within 2 days for pickup.",,
721686599317979136,marlow925,2024-06-28T22:29:13.7050000+01:00,"Afternoon of day 2, I figured, I better call them, to find out, what's going on ...",,
333909848762744832,potiii,2024-06-28T22:29:22.0600000+01:00,(Lets migrate to the general chat to not spamm this one anymore ),,
721686599317979136,marlow925,2024-06-28T22:29:37.6990000+01:00,"Lad goes: oh .. yeah .. the system gets that wrong, because UK and Ireland are lobbed together and it doesn't work for Ireland ...",,
721686599317979136,marlow925,2024-06-28T22:29:46.8950000+01:00,Let me fix that for you .. we'll collect that tomorrow.,,
333909848762744832,potiii,2024-06-28T22:29:54.4020000+01:00,Oh 😂,,
738497864258289744,dorito_082905,2024-06-30T04:03:00.2520000+01:00,,https://cdn.discordapp.com/attachments/1224713323409313872/1256807172222877727/IMG_20240629_200218_062.webp?ex=68537de4&is=68522c64&hm=c3ed268d257578307312bc31b24744b32bd586f3e11c7987342f34dc4412780c&,
738497864258289744,dorito_082905,2024-07-02T05:20:21.4770000+01:00,,"https://cdn.discordapp.com/attachments/1224713323409313872/1257551412724895815/IMG_20240701_210859439.jpg?ex=68539004&is=68523e84&hm=ff1d0e3f664368fff0e08f1b004d58b80b4206865be3eddce1c5db9b5f8b8e2d&,https://cdn.discordapp.com/attachments/1224713323409313872/1257551413291257887/IMG_20240701_210729374.jpg?ex=68539005&is=68523e85&hm=d6105f9101d683cbbde3231c893c6ad861dd01989087b3a007bb0701908583b5&,https://cdn.discordapp.com/attachments/1224713323409313872/1257551413672808539/IMG_20240701_210726061.jpg?ex=68539005&is=68523e85&hm=8c5f467a4940527baa4102d61da8b1c4294831d1f80f782f3ad7c39691c3308f&,https://cdn.discordapp.com/attachments/1224713323409313872/1257551414146760735/IMG_20240701_210721018.jpg?ex=68539005&is=68523e85&hm=9005d6f80ff791f01119035a52a0e95b51ff153be144949b8958efad25309fe9&,https://cdn.discordapp.com/attachments/1224713323409313872/1257551414792818698/IMG_20240701_210914291.jpg?ex=68539005&is=68523e85&hm=087b063b634df651b9f4b358aefcad634059474faf602c19a13625d93aa045a0&",
738497864258289744,dorito_082905,2024-07-02T05:20:24.2020000+01:00,I knew this day would come sooner or later,,
738497864258289744,dorito_082905,2024-07-02T05:22:44.1230000+01:00,@Poti you ask you recieve lol,,
738497864258289744,dorito_082905,2024-07-02T05:23:12.6470000+01:00,cage is a bit big but i can work with it fs,,
333909848762744832,potiii,2024-07-02T10:47:45.2650000+01:00,Ohhh this is the small cute npf,,
333909848762744832,potiii,2024-07-02T10:47:58.3980000+01:00,I was thinking thst you have the big chunky ones,,
738497864258289744,dorito_082905,2024-07-02T15:29:47.1100000+01:00,😭😭,,
530834990955757571,mondee_,2024-07-02T15:45:28.0400000+01:00,I just ordered my first camera so let’s see how this goes,,
333909848762744832,potiii,2024-07-02T16:34:27.1240000+01:00,Yayy,,
333909848762744832,potiii,2024-07-02T16:34:32.0150000+01:00,Which one,,
530834990955757571,mondee_,2024-07-02T16:39:46.1100000+01:00,Sony a6400 not my dream camera just something I can afford that’s decent,,
530834990955757571,mondee_,2024-07-02T16:43:24.5400000+01:00,I’m use to the gh5 because that’s what I used in film class but I just heard good things about Sony so ima try it out,,
721686599317979136,marlow925,2024-07-02T16:57:02.5990000+01:00,The Sony won't be quite as capable as the GH5 in modes / resolutions / fps etc. It will have better autofocus though.,,
333909848762744832,potiii,2024-07-02T20:55:19.2060000+01:00,"Both have their strengths and weaknesses , they are close enough tho, you can shoot very nice images w either ine",,
333909848762744832,potiii,2024-07-02T20:55:20.3630000+01:00,One,,
507216086966468608,mulchintime,2024-07-04T15:14:00.8290000+01:00,,"https://cdn.discordapp.com/attachments/1224713323409313872/1258425588532641853/20240702_184829.jpg?ex=68537268&is=685220e8&hm=83e0fdb8a97a53facdffe82c8c94d01c6e42758b0ce5a8a89eee14757e543eb4&,https://cdn.discordapp.com/attachments/1224713323409313872/1258425588776173709/IMG_20240618_141755.jpg?ex=68537268&is=685220e8&hm=31a49b2723b352ebb5be8fb3be6fbfcbaa14ac6109072a4ec9a295e0487e0dbb&",
413494385351852033,sethcopela,2024-07-04T22:41:35.8840000+01:00,share-your-face,,
1231736910297305184,qfa124,2024-07-06T01:02:01.6340000+01:00,bruh,,
954060407616708689,lkorhonen,2024-07-06T17:57:07.9160000+01:00,My set of gear lol,https://cdn.discordapp.com/attachments/1224713323409313872/1259191414521073684/IMG_20240706_195513.jpg?ex=685398a3&is=68524723&hm=97c2f815f4ff129ab7e51d2500e98c9ef4ccfb00c8440b504facfa74cfa9782e&,
954060407616708689,lkorhonen,2024-07-06T17:58:32.2570000+01:00,i know that it ain't even distantly professional,,
954060407616708689,lkorhonen,2024-07-06T18:11:56.9950000+01:00,my editing system is better tho,https://cdn.discordapp.com/attachments/1224713323409313872/1259195143521566851/image.png?ex=68539c1c&is=68524a9c&hm=53f6610dd5b08d0fffbdea66ed102bca302a55d5a2e31f991edf112f41821ab3&,
738497864258289744,dorito_082905,2024-07-06T22:10:24.6830000+01:00,we all start somewhere!,,
422183587844980747,gageywageyz,2024-07-09T05:59:06.0570000+01:00,"I have the canon eos c100, anyone know of any gimbals that would work on it? or do i need a rig",,
413494385351852033,sethcopela,2024-07-09T05:59:27.7430000+01:00,You need a rig also wrong channel,,
413494385351852033,sethcopela,2024-07-09T05:59:30.4510000+01:00,#🎥・gear-help,,
422183587844980747,gageywageyz,2024-07-09T05:59:51.2940000+01:00,yes sir,,
231947654236471297,hstiehda,2024-07-10T15:42:29.0400000+01:00,yall fw the vlogging setup?,https://cdn.discordapp.com/attachments/1224713323409313872/1260607080721809532/IMG_7582.jpg?ex=68537914&is=68522794&hm=8f59c3897b4891f37ab1633c9c2ae00fc38954688cff8241c63fcfb909a925e0&,
413494385351852033,sethcopela,2024-07-10T16:12:11.0080000+01:00,vlogging the next star system bro,,
492170034836275201,onemanonlyfans,2024-07-10T16:12:45.0400000+01:00,"tbh would prefer a longer lens, maybe a 200-600?",,
231947654236471297,hstiehda,2024-07-10T17:10:09.5080000+01:00,"personally i prefer the 150 over the 200, a little more wide",,
231947654236471297,hstiehda,2024-07-10T17:11:52.0770000+01:00,technically 240 not 150 mb,,
333909848762744832,potiii,2024-07-10T19:11:42.6950000+01:00,I really hope that he is joking here,,
413494385351852033,sethcopela,2024-07-10T19:25:55.3860000+01:00,nah he's dead serious,,
413494385351852033,sethcopela,2024-07-10T19:26:21.7570000+01:00,150 is perfect for vlogging yourself,,
738497864258289744,dorito_082905,2024-07-10T19:33:43.3190000+01:00,yeah volgging your pupil movements 🤣,,☝️ (1)
721686599317979136,marlow925,2024-07-10T19:34:30.0270000+01:00,"and you can crop in even more, if you use the cropped mode of the R7, which already is cropped by x1.6 to begin with.",,
721686599317979136,marlow925,2024-07-10T19:35:44.3400000+01:00,that be handier for birding. For vlogging you really want a wide lens.,,
231947654236471297,hstiehda,2024-07-10T19:54:28.5530000+01:00,oh i’m dead serious,,
983476501313900605,f35lightningii.exe,2024-07-11T05:11:13.0800000+01:00,vlogging with 150-600 :PepeLaugh:,,
333909848762744832,potiii,2024-07-11T12:26:14.8620000+01:00,"Or a cam operator , he can stay at home and just look out the window w his cam",,
333909848762744832,potiii,2024-07-11T12:26:18.8930000+01:00,Perfect shot,,
333909848762744832,potiii,2024-07-11T12:26:57.2330000+01:00,"Wildlife videography, the life of a vlogger",,
836575337927540828,fresh1289,2024-07-13T07:15:17.7500000+01:00,,https://cdn.discordapp.com/attachments/1224713323409313872/1261566606480380025/IMG_4852.jpg?ex=6853aaf5&is=68525975&hm=392fd46876e6e36b6765c0cf39ac178b3f391ee38adbb426e301cdd1e1337557&,
836575337927540828,fresh1289,2024-07-13T07:59:52.9240000+01:00,,https://cdn.discordapp.com/attachments/1224713323409313872/1261577826889502790/IMG_4853.jpg?ex=6853b568&is=685263e8&hm=926c742f5c53492596247451de1b8c0488bcbea866f3021a4fb7e306e6001efb&,
773911690629742602,ejvali,2024-07-14T22:52:57.7100000+01:00,how is the canon r50?,,
954060407616708689,lkorhonen,2024-07-14T23:00:51.1960000+01:00,"great camera for both photo and video, got any more specific questions?",,
773911690629742602,ejvali,2024-07-14T23:01:43.5940000+01:00,is the grip okay?,,
954060407616708689,lkorhonen,2024-07-14T23:02:40.7810000+01:00,"yes, in my opinion canon has the best ergonomics at least compared to sony and lumix",,
773911690629742602,ejvali,2024-07-14T23:03:14.0910000+01:00,thankss. do you think its worth to go into r10?,,
773911690629742602,ejvali,2024-07-14T23:03:19.8050000+01:00,for me?,,
954060407616708689,lkorhonen,2024-07-14T23:03:41.4680000+01:00,what are you planning to use it for,,
773911690629742602,ejvali,2024-07-14T23:03:55.1760000+01:00,"travel and cars, photo and video",,
773911690629742602,ejvali,2024-07-14T23:04:36.5740000+01:00,more specifically want to start making (travel related) short films so i will do heavy editing,,
954060407616708689,lkorhonen,2024-07-14T23:07:55.5540000+01:00,"found this on reddit: The R10 can record 4k60, at the cost of a heavy crop. Both record 4k30 downsampled from the full sensor.
 

 The R50 works as USB webcam, the R10 needs a capture card or Canon's EOS Webcam Utility to use as a webcam.
 

 The R50 doesn't have a full-mechanical shutter option like the R10, but electronic first-curtain works just as well 99% of the time.
 

 The R10's burst rate is slightly faster, 15/23 vs 12/15 FPS on the R50. More importantly its buffer is also significantly larger, and clears faster as the R10 is compatible with UHS-II SD cards.
 

 The R10 has a 5-pin hotshoe for older Canon speedlite models, to use them on the R50 you'd need the AD-E1 adapter.",,
172002275412279296,Tatsu#8792,2024-07-14T23:07:56.0980000+01:00,"@Lauri | R50 | iPhone 
 **Congrats you've earned the `Active Chatter (2k+)` role for chatting long enough in this discord!**
 Enjoy your new role and position in the discord!",,
954060407616708689,lkorhonen,2024-07-14T23:08:28.4600000+01:00,so depends on the price difference,,
954060407616708689,lkorhonen,2024-07-14T23:08:57.8520000+01:00,i got r50 kit deal for 579 while r10 wouldve costed 400 more,,
773911690629742602,ejvali,2024-07-14T23:09:53.1510000+01:00,there is r10 for 750€,,
773911690629742602,ejvali,2024-07-14T23:09:56.1900000+01:00,new,,
954060407616708689,lkorhonen,2024-07-14T23:10:06.7680000+01:00,kit or body only,,
773911690629742602,ejvali,2024-07-14T23:10:10.4830000+01:00,body only,,
954060407616708689,lkorhonen,2024-07-14T23:13:59.3350000+01:00,do you need 4k60 for something and what'd be the price of r50? (4k24/30 is imo enough in 95% of cases),,
738497864258289744,dorito_082905,2024-07-15T00:37:18.2360000+01:00,travel? I recommend the ZV-E10 from sony,,
738497864258289744,dorito_082905,2024-07-15T00:37:41.7350000+01:00,super compact records 4k60P,,
738497864258289744,dorito_082905,2024-07-15T00:38:30.1950000+01:00,you can pick one up for 5-600 too so cheaper thant he r50,,
200574165843968001,beepbeepshengcai,2024-07-15T02:21:29.9840000+01:00,"Introducing my new machine which I've dubbed The Beast, nano 0.05inch sensor with global shutter for insane readout speeds, 6x ND rotating magazine, solid stainless steel keychain for convenient rigging, and a slick pink coat that will turn heads even on the biggest of productions",https://cdn.discordapp.com/attachments/1224713323409313872/1262217445746151486/SPOILER_20240715_090645.jpg?ex=68536619&is=68521499&hm=ae937f93079b887709f17fef618945f4de7071c53830309475ebd744f90c7c98&,
413494385351852033,sethcopela,2024-07-15T02:26:54.3880000+01:00,absolutely god tier gear,,
413494385351852033,sethcopela,2024-07-15T02:27:12.0580000+01:00,Pinned a message.,,
200574165843968001,beepbeepshengcai,2024-07-15T07:15:45.6810000+01:00,It's actually a really useful piece of kit as an icebreaker for event photography,,
773911690629742602,ejvali,2024-07-15T08:32:14.6630000+01:00,580€ for r50,,
773911690629742602,ejvali,2024-07-15T08:32:35.3680000+01:00,is it great for photos tho? it doesnt have a viewfinder,,
773911690629742602,ejvali,2024-07-15T08:32:55.2950000+01:00,but is viewfinder used when you have glasses? 🤔,,
954060407616708689,lkorhonen,2024-07-15T10:56:59.8210000+01:00,Lol no,,
954060407616708689,lkorhonen,2024-07-15T10:57:13.0520000+01:00,It’s maximum 8 bit 4K30,,
954060407616708689,lkorhonen,2024-07-15T10:57:42.5630000+01:00,And 1.22x crop for 30p,,
954060407616708689,lkorhonen,2024-07-15T10:58:10.3830000+01:00,"So basically any color grading, even very basic, will ruin the video",,
954060407616708689,lkorhonen,2024-07-15T10:58:21.2820000+01:00,As it’s 8 bit,,
954060407616708689,lkorhonen,2024-07-15T10:59:16.5810000+01:00,"If you really know you need 4k60 go for the r10 otherwise save money and pick the r50, they have the exact same sensor so image quality is same",,
773911690629742602,ejvali,2024-07-15T11:01:25.2220000+01:00,okay thanks,,
773911690629742602,ejvali,2024-07-15T11:01:30.1960000+01:00,10bit,,
773911690629742602,ejvali,2024-07-15T11:01:37.2170000+01:00,the ii,,
954060407616708689,lkorhonen,2024-07-15T11:02:21.4360000+01:00,"Ah, but that it was an ii was never mentioned, right?",,
773911690629742602,ejvali,2024-07-15T11:02:40.5440000+01:00,oh right,,
773911690629742602,ejvali,2024-07-15T11:02:46.5160000+01:00,the r50 has 10bit too i think,,
773911690629742602,ejvali,2024-07-15T11:02:48.1710000+01:00,just not log,,
954060407616708689,lkorhonen,2024-07-15T11:03:25.3340000+01:00,It is called hdr pq and it is a logarithmic profile even though it’s not called straightly log,,
773911690629742602,ejvali,2024-07-15T11:03:39.4780000+01:00,yeah,,
773911690629742602,ejvali,2024-07-15T11:03:43.0470000+01:00,hows it to grade,,
773911690629742602,ejvali,2024-07-15T11:03:51.2220000+01:00,and work with ti basically,,
954060407616708689,lkorhonen,2024-07-15T11:04:53.0830000+01:00,"Nice, my pc runs it well and it doesn’t need very aggressive color grading if preferred",,
773911690629742602,ejvali,2024-07-15T11:05:05.4110000+01:00,what pc do u have,,
773911690629742602,ejvali,2024-07-15T11:05:16.5960000+01:00,btw do you have any vid to showcase?,,
954060407616708689,lkorhonen,2024-07-15T11:05:22.6780000+01:00,"13700kf, 4070ti, 32gb ddr5",,
773911690629742602,ejvali,2024-07-15T11:05:48.1970000+01:00,bro,,
773911690629742602,ejvali,2024-07-15T11:05:56.7390000+01:00,ill use generated media,,
773911690629742602,ejvali,2024-07-15T11:05:59.0520000+01:00,nice pc,,
954060407616708689,lkorhonen,2024-07-15T11:06:38.2600000+01:00,If ur using davinci resolve btw it won’t open h264 or h265 422 10 bit at all,,
954060407616708689,lkorhonen,2024-07-15T11:06:45.9270000+01:00,In free version,,
773911690629742602,ejvali,2024-07-15T11:06:50.8160000+01:00,u got studio?,,
954060407616708689,lkorhonen,2024-07-15T11:07:14.0450000+01:00,"No, I got premiere pro",,
773911690629742602,ejvali,2024-07-15T11:07:16.8210000+01:00,oh,,
773911690629742602,ejvali,2024-07-15T11:07:18.0940000+01:00,ill convert it to some other codec i think thats possible and you dont lose any information,,
773911690629742602,ejvali,2024-07-15T11:07:26.1090000+01:00,like prores or the other one idk whats called,,
773911690629742602,ejvali,2024-07-15T11:07:52.5670000+01:00,or ill get a mb lmao,,
954060407616708689,lkorhonen,2024-07-15T11:08:09.1740000+01:00,I’ll give one later,,
773911690629742602,ejvali,2024-07-15T11:08:15.0920000+01:00,okay thank you,,
954060407616708689,lkorhonen,2024-07-15T11:08:35.4750000+01:00,Raw footage?,,
773911690629742602,ejvali,2024-07-15T11:08:38.4540000+01:00,the new siggy looks cool and its now available in the store,,
773911690629742602,ejvali,2024-07-15T11:08:56.3170000+01:00,yeah if u have,,
773911690629742602,ejvali,2024-07-15T11:09:03.5030000+01:00,but would also like to see how u graded it,,
954060407616708689,lkorhonen,2024-07-15T11:09:24.8390000+01:00,Just got 70GB this weekend but I haven’t graded yet,,
773911690629742602,ejvali,2024-07-15T11:09:28.0600000+01:00,btw do you think its worth investing into premiere,,
773911690629742602,ejvali,2024-07-15T11:09:30.7300000+01:00,oh lol,,
773911690629742602,ejvali,2024-07-15T11:09:32.2050000+01:00,nice,,
773911690629742602,ejvali,2024-07-15T11:09:44.3700000+01:00,i just opened davinci and it felt so simple,,
954060407616708689,lkorhonen,2024-07-15T11:09:51.5780000+01:00,No unless you get a good deal,,
773911690629742602,ejvali,2024-07-15T11:09:51.8880000+01:00,maybe we are talking in wron gchannel btw,,
773911690629742602,ejvali,2024-07-15T11:09:56.5930000+01:00,oh ok,,
954060407616708689,lkorhonen,2024-07-15T11:10:13.9860000+01:00,Like I got 144€ for year whole creative cloud,,
773911690629742602,ejvali,2024-07-15T11:10:21.7310000+01:00,wow,,
738497864258289744,dorito_082905,2024-07-15T20:11:53.7450000+01:00,It's like 200 for davinci studio,,
738497864258289744,dorito_082905,2024-07-15T20:12:02.5810000+01:00,Not year but lifetime,,
773911690629742602,ejvali,2024-07-15T20:12:11.0520000+01:00,i know,,
773911690629742602,ejvali,2024-07-15T20:12:13.3840000+01:00,300*,,
738497864258289744,dorito_082905,2024-07-15T21:25:47.3580000+01:00,295*,,
773911690629742602,ejvali,2024-07-15T21:27:15.7970000+01:00,thats called marketing,,
738497864258289744,dorito_082905,2024-07-15T21:33:01.2750000+01:00,its only 200+ not 300,,
738497864258289744,dorito_082905,2024-07-15T21:33:02.5380000+01:00,lol,,
738497864258289744,dorito_082905,2024-07-15T21:33:08.1930000+01:00,"""i do not own studio""",,
773911690629742602,ejvali,2024-07-15T21:34:28.8950000+01:00,fair,,
773911690629742602,ejvali,2024-07-15T21:34:55.5820000+01:00,if i would be buying studio tho i would get one of their keebs or some accessory that is 100€ more and has studio with it,,
954060407616708689,lkorhonen,2024-07-16T01:21:10.3620000+01:00,Including vat it’d total 341€ for me,,
954060407616708689,lkorhonen,2024-07-16T01:22:41.0820000+01:00,(Yes there’s 20%+ extra tax in most European countries),,
738497864258289744,dorito_082905,2024-07-16T01:34:23.4030000+01:00,Im sorry.. TWENTY PRECENT?,,
738497864258289744,dorito_082905,2024-07-16T01:34:29.0470000+01:00,i thought calis 9% was high,,
954060407616708689,lkorhonen,2024-07-16T01:49:11.0090000+01:00,"24% in Finland, gonna rise to 25.5% soon",,
333909848762744832,potiii,2024-07-16T02:00:21.1450000+01:00,Here its 27 :)))),,
738497864258289744,dorito_082905,2024-07-16T02:05:56.6720000+01:00,yikes,,
738497864258289744,dorito_082905,2024-07-16T02:06:11.8880000+01:00,if i lived there i would quite literally evade tax,,
333909848762744832,potiii,2024-07-16T02:25:28.7260000+01:00,Its not so easy here like in the Us,,
738497864258289744,dorito_082905,2024-07-16T02:36:14.8560000+01:00,"whats the ""petrol"" prices like",,
