AuthorID,Author,Date,Content,Attachments,Reactions
413494385351852033,sethcopela,2024-04-02T14:35:20.2040000+01:00,I guess I'll start this off with a banger. We use this at Uni for our Virtual Production/Volumetric Light Stage,https://cdn.discordapp.com/attachments/1224713323409313872/1224713783310553238/zLFzQAs.png?ex=68536958&is=685217d8&hm=9c489bdaa852d490bd64bd9940c00208b3a26312a618716d93abd03232e1683e&,🔥 (2)
413494385351852033,sethcopela,2024-04-02T14:35:31.1070000+01:00,ARRI LF I believe?,,
642197042596413450,uncamad,2024-04-02T14:36:26.6950000+01:00,Yeah but what's *YOUR* gear?,,
642197042596413450,uncamad,2024-04-02T14:36:37.0470000+01:00,😉,,
413494385351852033,sethcopela,2024-04-02T14:37:17.7240000+01:00,my personal gear,,
413494385351852033,sethcopela,2024-04-02T14:37:32.0380000+01:00,I don't actually own much of my own gear,,
413494385351852033,sethcopela,2024-04-02T14:37:38.0580000+01:00,I use other people's stuff lol,,
413494385351852033,sethcopela,2024-04-02T14:37:56.3150000+01:00,Lemme post what else i have tho,,
413494385351852033,sethcopela,2024-04-02T14:39:42.2620000+01:00,for photography I mainly use my Fujifilm X-H1,https://cdn.discordapp.com/attachments/1224713323409313872/1224714883044475042/OcocuT3.jpeg?ex=68536a5e&is=685218de&hm=33ba93d2e2f59f8c86e540fdfe37817b866e5d8dd0d47c9e420af76a36ecafd0&,🔥 (1)
413494385351852033,sethcopela,2024-04-02T14:39:48.7800000+01:00,I have various fuji lenses for it,,
333909848762744832,potiii,2024-04-02T14:40:20.7530000+01:00,,"https://cdn.discordapp.com/attachments/1224713323409313872/1224715043917135892/IMG_3367.jpg?ex=68536a84&is=68521904&hm=7d443cd03de62209ac1677501e60edbc3fb3c851fab6a62594811dfc6d2662c8&,https://cdn.discordapp.com/attachments/1224713323409313872/1224715044386766918/IMG_3366.jpg?ex=68536a84&is=68521904&hm=2acc33913bbaf347d59052b97f41e45dd4fe74e3ab3b560a6728e02e4e246999&",🔥 (2)
333909848762744832,potiii,2024-04-02T14:41:38.1380000+01:00,"This is my a7SIII / komodo rig , ofc w the komodo i use a wooden cam battery plate the sdi module for ninja , so i tweak SOME stuff",,
333909848762744832,potiii,2024-04-02T14:41:46.2150000+01:00,But its 90% the same,,
413494385351852033,sethcopela,2024-04-02T14:43:05.8870000+01:00,,https://cdn.discordapp.com/attachments/1224713323409313872/1224715736836997142/IMG_1554.jpg?ex=68536b29&is=685219a9&hm=7f1f58f57f2b11ae6e2ad00ef80f59c4e730fb3ba6e22c7c936ec878ba424e4c&,
413494385351852033,sethcopela,2024-04-02T14:43:22.8320000+01:00,,https://cdn.discordapp.com/attachments/1224713323409313872/1224715807917871124/IMG_1465.jpg?ex=68536b3a&is=685219ba&hm=688ea65d893bbc132d39564757569693f4e36b2e30a09636b82930c070e8c9b9&,
413494385351852033,sethcopela,2024-04-02T14:43:32.6430000+01:00,,https://cdn.discordapp.com/attachments/1224713323409313872/1224715848766324846/IMG_1435.jpg?ex=68536b44&is=685219c4&hm=c7d390e9252a520f4164c3411607738460ed2a62cbc1d7e05a30dba51abe9301&,🔥 (1)
413494385351852033,sethcopela,2024-04-02T14:43:37.0300000+01:00,I have a lot of film cameras,,
413494385351852033,sethcopela,2024-04-02T14:43:57.3130000+01:00,I had to scroll back 2 years of photos to find a photo of them all together...,,
413494385351852033,sethcopela,2024-04-02T14:44:12.6310000+01:00,they're currently just strewn around my house in random corners lol,,😂 (1)
413494385351852033,sethcopela,2024-04-02T14:44:38.6880000+01:00,beautiful rig,,❤️ (1)
413494385351852033,sethcopela,2024-04-02T14:45:17.4870000+01:00,,https://cdn.discordapp.com/attachments/1224713323409313872/1224716288581173418/IMG_7357.jpg?ex=68536bad&is=68521a2d&hm=3ffa895689f6b0b4960f70f38fc8bf45c26d20837c53c10518f51682ece2aa54&,
413494385351852033,sethcopela,2024-04-02T14:45:41.0300000+01:00,,https://cdn.discordapp.com/attachments/1224713323409313872/1224716387516153979/IMG_7715.jpg?ex=68536bc4&is=68521a44&hm=b65f470569c1ff2805c6c0e26e08d2193c1147fda7bdfd6644d18f9a38f4dc9a&,🔥 (2)
413494385351852033,sethcopela,2024-04-02T14:45:49.4640000+01:00,RED SCARLET W,,
445551814687981568,jerektio_,2024-04-02T15:56:58.9470000+01:00,,https://cdn.discordapp.com/attachments/1224713323409313872/1224734330534887476/IMG_2643.jpg?ex=68537c7a&is=68522afa&hm=62989f71fc29c9729b37439276a7f5ed7e165a3c8ba14143227821e1d63ad3bb&,🔥 (4)
445551814687981568,jerektio_,2024-04-02T15:57:07.2090000+01:00,my epic rig 💀,,
445551814687981568,jerektio_,2024-04-02T15:57:19.9610000+01:00,I'll post another picture in 2 years and then see where we're at,,
857245714785501214,ayysaph,2024-04-02T15:59:36.8460000+01:00,Panasonic?,,
857245714785501214,ayysaph,2024-04-02T15:59:38.4740000+01:00,let me guess,,
235148962103951360,Carl-bot#1536,2024-04-02T15:59:51.5420000+01:00,"Alright **kiwiseth**, I'll remind you about Jere's update on his rig in 2 years and 1 day. ID: 67027114",,
445551814687981568,jerektio_,2024-04-02T16:00:02.5170000+01:00,yep,,
857245714785501214,ayysaph,2024-04-02T16:00:11.6140000+01:00,GH.....,,
857245714785501214,ayysaph,2024-04-02T16:00:13.8150000+01:00,5?,,
445551814687981568,jerektio_,2024-04-02T16:00:17.2630000+01:00,thank you 🤣,,
857245714785501214,ayysaph,2024-04-02T16:00:18.6260000+01:00,not 6 i think,,
445551814687981568,jerektio_,2024-04-02T16:00:23.3120000+01:00,4 actually,,
413494385351852033,sethcopela,2024-04-02T16:00:25.0820000+01:00,I'm gonna hold you to that,,
857245714785501214,ayysaph,2024-04-02T16:00:36.5910000+01:00,wait why am i red,,
413494385351852033,sethcopela,2024-04-02T16:00:38.2030000+01:00,2 years from now... maybe I'll be employed with a studio finally,,💪 (2)
445551814687981568,jerektio_,2024-04-02T16:00:49.4070000+01:00,well assuming I'm still on this server and I use discord I definitely will,,
413494385351852033,sethcopela,2024-04-02T16:00:50.0510000+01:00,huh?,,
857245714785501214,ayysaph,2024-04-02T16:00:59.1170000+01:00,the words are red,,
857245714785501214,ayysaph,2024-04-02T16:01:00.5540000+01:00,on my end,,
413494385351852033,sethcopela,2024-04-02T16:01:03.5330000+01:00,oh weird,,
857245714785501214,ayysaph,2024-04-02T16:01:11.8710000+01:00,ok reloading the page it removed it,,
413494385351852033,sethcopela,2024-04-02T16:01:15.5540000+01:00,lol,,
857245714785501214,ayysaph,2024-04-02T16:01:25.1640000+01:00,hey my first camera was a GH4!!,,
413494385351852033,sethcopela,2024-04-02T16:01:38.5140000+01:00,Mine was a Nikon powershot something or whatever,,
445551814687981568,jerektio_,2024-04-02T16:01:46.1200000+01:00,"great choice, it is my first cam too lmao",,👍 (1)
857245714785501214,ayysaph,2024-04-02T16:01:49.7160000+01:00,i turned it in to MPB about a year and half ago so yeah,,
857245714785501214,ayysaph,2024-04-02T16:02:05.0520000+01:00,do you think you want to go with Panasonic in the future?,,
413494385351852033,sethcopela,2024-04-02T16:02:12.7680000+01:00,my first video camera was a GoPro I think? That I made vlogs with while sailing,,😁 (1)
857245714785501214,ayysaph,2024-04-02T16:02:19.7710000+01:00,side note: i see you won the loot boxes!,,
413494385351852033,sethcopela,2024-04-02T16:02:26.5800000+01:00,"then I started using a Sony camera, one of the broadcast ones",,
445551814687981568,jerektio_,2024-04-02T16:02:39.7560000+01:00,well there is the S lineup but I'll probably steer away from the gh4 series because mft,,
857245714785501214,ayysaph,2024-04-02T16:02:48.6500000+01:00,valid point ^,,
857245714785501214,ayysaph,2024-04-02T16:02:49.8100000+01:00,however,,
857245714785501214,ayysaph,2024-04-02T16:02:57.9750000+01:00,the newly released G9 II is incredible,,
445551814687981568,jerektio_,2024-04-02T16:03:10.7870000+01:00,yeah I looked it up before I even opened any,,
445551814687981568,jerektio_,2024-04-02T16:03:13.7030000+01:00,I wanted the cool deco,,😄 (1)
857245714785501214,ayysaph,2024-04-02T16:03:23.3480000+01:00,"it's got like 6k 60, 4k 120, V-log, great dynamic range, and GOOD autofocus!",,
857245714785501214,ayysaph,2024-04-02T16:03:24.4750000+01:00,finally,,
445551814687981568,jerektio_,2024-04-02T16:03:51.4800000+01:00,yeah the contrast autofocus is genuinely ass no matter which mode have it set to,,
445551814687981568,jerektio_,2024-04-02T16:04:14.0960000+01:00,it's ok in good lighting but if it's any dim it renders useless,,
857245714785501214,ayysaph,2024-04-02T16:04:20.3890000+01:00,that was the main reason for me getting rid of it,,
857245714785501214,ayysaph,2024-04-02T16:04:24.2190000+01:00,also,,
857245714785501214,ayysaph,2024-04-02T16:04:25.5140000+01:00,no gammas,,
445551814687981568,jerektio_,2024-04-02T16:04:50.8060000+01:00,haha this turned into a roasting session,,😂 (1)
445551814687981568,jerektio_,2024-04-02T16:05:27.6970000+01:00,but it's been a good tool to get started with and I'll look into upgrading the body perhaps at the end of this year,,👏 (1)
445551814687981568,jerektio_,2024-04-02T16:05:55.2260000+01:00,I have more essential purchases upcoming like lenses and lighting yk,,
857245714785501214,ayysaph,2024-04-02T16:06:09.6460000+01:00,yeah tbh those are more important imo,,
857245714785501214,ayysaph,2024-04-02T16:06:12.5610000+01:00,what lens are you using?,,
445551814687981568,jerektio_,2024-04-02T16:06:38.5180000+01:00,currently only a G-vario 14-140mm,,
445551814687981568,jerektio_,2024-04-02T16:06:43.3830000+01:00,3.5-5.6,,
857245714785501214,ayysaph,2024-04-02T16:06:47.9980000+01:00,wow,,
857245714785501214,ayysaph,2024-04-02T16:06:53.6860000+01:00,that's a 28-280 lol,,
445551814687981568,jerektio_,2024-04-02T16:07:00.1730000+01:00,yep lmao,,
857245714785501214,ayysaph,2024-04-02T16:07:06.2280000+01:00,not a bad choice for a first lens tho!,,
857245714785501214,ayysaph,2024-04-02T16:07:12.6110000+01:00,i'd recommend investing in some good primes,,
445551814687981568,jerektio_,2024-04-02T16:07:26.1520000+01:00,yeah that's what I'm planning,,
857245714785501214,ayysaph,2024-04-02T16:07:52.0080000+01:00,if you really have the extra money,,
857245714785501214,ayysaph,2024-04-02T16:08:12.4910000+01:00,Lumix has these crazy lenses,,
857245714785501214,ayysaph,2024-04-02T16:08:22.0400000+01:00,10-25 f/1.7 and 20-50 f/1.7,,
857245714785501214,ayysaph,2024-04-02T16:08:30.4820000+01:00,constant 1.7 is unbelievable,,
445551814687981568,jerektio_,2024-04-02T16:08:36.3360000+01:00,pro series?,,
445551814687981568,jerektio_,2024-04-02T16:08:50.2870000+01:00,indeed,,
857245714785501214,ayysaph,2024-04-02T16:09:15.9540000+01:00,https://www.bhphotovideo.com/c/search?q=panasonic%20lens&filters=fct_category%3Amirrorless_camera_lenses_17912%2Cfct_lenses-kits_7315%3Alenses-only%2Cfct_maximum-aperture_3574%3Af-1.7%2Cfct_zooms-primes_5903%3Azoom-lenses,,
445551814687981568,jerektio_,2024-04-02T16:10:02.4640000+01:00,"1,5k lens on a 300 body, I see no issue 🤣",,🤣 (1)
857245714785501214,ayysaph,2024-04-02T16:10:41.8950000+01:00,"if you get a GH5 or something for $600 or $700, that pair is going to be absolutely 🔥",,
857245714785501214,ayysaph,2024-04-02T16:10:57.0820000+01:00,"actually in photography, lenses are way more important than bodies",,
857245714785501214,ayysaph,2024-04-02T16:11:07.2700000+01:00,so that's good for a photographer,,
445551814687981568,jerektio_,2024-04-02T16:11:10.3290000+01:00,then borderline worth considering,,
445551814687981568,jerektio_,2024-04-02T16:11:17.4500000+01:00,yeah that's what I've heard,,
857245714785501214,ayysaph,2024-04-02T16:11:24.5940000+01:00,it's true!,,
445551814687981568,jerektio_,2024-04-02T16:11:25.6050000+01:00,but it still a crazy price gap,,
857245714785501214,ayysaph,2024-04-02T16:11:43.6510000+01:00,do you mean the GH4 to the GH5 or the GH4 to the lens?,,
445551814687981568,jerektio_,2024-04-02T16:11:56.8100000+01:00,gh4 to the lens,,
445551814687981568,jerektio_,2024-04-02T16:12:20.8180000+01:00,although looking at the price of some lenses out there it's probably normal to have that sorta price ratios in photography?,,
857245714785501214,ayysaph,2024-04-02T16:13:31.1070000+01:00,i mean if someone uses a Sony NEX camera (around $200) and gets a Viltrox 75 1.2 for portraits (becomes a 110-ish mil) it's going to be a ton better than a Sony a6700 (around $1400) with a 55-210 f/4.5-6.3,,
445551814687981568,jerektio_,2024-04-02T16:14:50.8620000+01:00,subjective but I see where you're coming from,,
857245714785501214,ayysaph,2024-04-02T16:15:38.5070000+01:00,sorry,,
857245714785501214,ayysaph,2024-04-02T16:15:50.5490000+01:00,maybe not always,,
857245714785501214,ayysaph,2024-04-02T16:16:09.2330000+01:00,"but in general, photography can be done on really cheap cameras (unlike videography)",,
445551814687981568,jerektio_,2024-04-02T16:16:23.4580000+01:00,I agree,,
857245714785501214,ayysaph,2024-04-02T16:17:26.4170000+01:00,"unfortunately, you kind of have to go above $1000 to get good video cameras (with a few exceptions)",,
445551814687981568,jerektio_,2024-04-02T16:17:52.8290000+01:00,yep,,
857245714785501214,ayysaph,2024-04-02T16:18:41.3770000+01:00,"well, i think this channel is supposed to be **share-your-gear**, so maybe we should move to gear-help",,
445551814687981568,jerektio_,2024-04-02T16:18:55.0990000+01:00,had the same thoughts lol,,😂 (1)
445551814687981568,jerektio_,2024-04-02T16:19:07.6590000+01:00,everything relevant got buried,,😂 (1)
721686599317979136,marlow925,2024-04-02T18:31:05.4860000+01:00,,https://cdn.discordapp.com/attachments/1224713323409313872/1224773113452171416/20240402_183036.jpg?ex=6853a099&is=68524f19&hm=8682be45e1d3c3e315354aa8ea311751eac531d5e1d2fa6602a97205f2474710&,
721686599317979136,marlow925,2024-04-02T18:31:33.7860000+01:00,"Shoulder rig, I recently put together. BMPCC 6k, Canon CN-E 18-80mm T/4.4 IS PZ cine zoom.",,❤️ (3)
1122989053806137386,kaijg.05,2024-04-02T20:18:03.1180000+01:00,,https://cdn.discordapp.com/attachments/1224713323409313872/1224800030985162833/20231021_172715.jpg?ex=6853b9ab&is=6852682b&hm=34e7611780dad1024f716f713882dd0f915f0f76bfea8c1107624d2bd2cd66e5&,🔥 (3)
1122989053806137386,kaijg.05,2024-04-02T20:18:37.4100000+01:00,Video rig I did for a wedding. Went handheld with it too...,,
857245714785501214,ayysaph,2024-04-02T20:25:29.2010000+01:00,Wow! Great job. Looks like an S5 something?,,
857245714785501214,ayysaph,2024-04-02T20:25:42.7220000+01:00,or at least a squarer Panasonic camera,,
1122989053806137386,kaijg.05,2024-04-02T20:26:41.1410000+01:00,Yup! S5iix rig,,❤️ (1)
857245714785501214,ayysaph,2024-04-02T20:27:59.3150000+01:00,That also looks like a telephoto lens,,
857245714785501214,ayysaph,2024-04-02T20:28:31.1570000+01:00,"From your experience, what lenses are necessary for wedding videography?",,
1122989053806137386,kaijg.05,2024-04-02T20:28:46.4820000+01:00,It's a 100-400 f5-6.3 from sigma,,👍 (4)
1122989053806137386,kaijg.05,2024-04-02T20:29:14.1900000+01:00,"Well, it depends on your goal with the video",,
857245714785501214,ayysaph,2024-04-02T20:29:56.3520000+01:00,Just saw your profile section. It seems like you have more lenses on the telephoto side than on the wide angle side.,,
1122989053806137386,kaijg.05,2024-04-02T20:30:09.2270000+01:00,"Definitely, that's my style for sure",,
1122989053806137386,kaijg.05,2024-04-02T20:30:25.8170000+01:00,I do more cinema documentary style for my weddings,,
1122989053806137386,kaijg.05,2024-04-02T20:30:55.7800000+01:00,"I like up tight shots that show important details, especially during the bridals and first/last dance",,☝️ (8)
1122989053806137386,kaijg.05,2024-04-02T20:31:46.1990000+01:00,"Some people just like documenting things as they happen, so their priorities are getting the whole shot. In that case, you'd just rely on wider ranges of lenses",,
1122989053806137386,kaijg.05,2024-04-02T20:31:57.4820000+01:00,It honestly depends on your style,,
1122989053806137386,kaijg.05,2024-04-02T20:32:06.9560000+01:00,And what the customer asks for,,
857245714785501214,ayysaph,2024-04-02T20:32:17.8230000+01:00,Thanks for sharing!,,🤙 (9)
1122989053806137386,kaijg.05,2024-04-02T20:35:38.2310000+01:00,Ofc!,,
435459109488295961,theolly,2024-04-04T14:59:14.4530000+01:00,is that a deity d4 mini?,,
1122989053806137386,kaijg.05,2024-04-04T17:37:57.0010000+01:00,"Yeah, killer mic for the size",,
435459109488295961,theolly,2024-04-04T17:41:55.0750000+01:00,"nice one, yeah ive got the d4 duo",,
1122989053806137386,kaijg.05,2024-04-04T18:18:22.5030000+01:00,"Lit, haven't seen your rig yet",,
236940575411011585,oreoliveson,2024-04-04T18:35:03.7490000+01:00,The perfect vlog setup,https://cdn.discordapp.com/attachments/1224713323409313872/1225498888501199028/20240404_202226.jpg?ex=6853a187&is=68525007&hm=a812db35aace3079193264ef118c5a64564d92abf6cd89af442a94fdc1cf9ebd&,🔥 (10)
857245714785501214,ayysaph,2024-04-04T18:45:05.5580000+01:00,lemme guess,,
857245714785501214,ayysaph,2024-04-04T18:45:18.9010000+01:00,ZV-E1 with Sony 20 1.8?,,
857245714785501214,ayysaph,2024-04-04T18:45:21.2770000+01:00,or 14 1.8?,,
857245714785501214,ayysaph,2024-04-04T18:45:26.5110000+01:00,were you the one that got the 14?,,
236940575411011585,oreoliveson,2024-04-04T19:08:21.3870000+01:00,Yes the 14,,
236940575411011585,oreoliveson,2024-04-04T19:08:57.7130000+01:00,It's important cause then you can turn on dynamic stabilization and still vlog comfortably with the crop it does,,👍 (9)
435459109488295961,theolly,2024-04-04T19:17:48.8210000+01:00,Haha that's because I primarily do photography.,,
435459109488295961,theolly,2024-04-04T19:18:05.6750000+01:00,My video setup is just camera and the d4 duo lol,,
435459109488295961,theolly,2024-04-04T19:25:03.5940000+01:00,Shameless plug for Photography Lounge,,😎 (8)
435459109488295961,theolly,2024-04-04T19:36:29.8500000+01:00,But I've got media job coming up this summer which may warrant a more 'proper' video setup investment,,
447860414089527296,godofmonkeys,2024-04-05T00:14:00.7050000+01:00,cleaned up a bit,https://cdn.discordapp.com/attachments/1224713323409313872/1225584187893878824/IMG_1013.jpg?ex=6853f0f8&is=68529f78&hm=b763cd84e67535e8fb95f682b3888435b3fd88179510eb46928be5023cb008d2&,
413494385351852033,sethcopela,2024-04-05T00:51:48.9760000+01:00,:wut:,,
413494385351852033,sethcopela,2024-04-05T00:51:54.5490000+01:00,god damn,,
413494385351852033,sethcopela,2024-04-05T00:52:06.2220000+01:00,that looks really satisfying lol,,
447860414089527296,godofmonkeys,2024-04-05T00:53:02.2500000+01:00,sure better than before,,
413494385351852033,sethcopela,2024-04-05T00:53:45.7340000+01:00,do you have a photo of before,,
447860414089527296,godofmonkeys,2024-04-05T00:54:20.6740000+01:00,not really,,
1122989053806137386,kaijg.05,2024-04-05T05:42:35.3820000+01:00,"I def get that, still worth showing off!",,
435459109488295961,theolly,2024-04-05T13:20:42.8230000+01:00,here you go,https://cdn.discordapp.com/attachments/1224713323409313872/1225782168027009055/20230322_145043.jpg?ex=6854009a&is=6852af1a&hm=be4ace03565d76d79b17924293570de810f9f5c0ddd929c250c59b8068f08ba1&,
413494385351852033,sethcopela,2024-04-08T01:45:35.6810000+01:00,:cedomgflip:,,
333909848762744832,potiii,2024-04-08T07:39:36.3420000+01:00,@Olly really cool how do you like the sigma?,,
333909848762744832,potiii,2024-04-08T08:22:24.1090000+01:00,Well my L bracket w the small rig dji power supply plate didn’t arrive yet so this is a budget solution for the “creator rig “,https://cdn.discordapp.com/attachments/1224713323409313872/1226794259164823572/IMG_3684.jpg?ex=6853bab0&is=68526930&hm=e8090a7291436fb125183b2f7e034ab7c1aae9d1234c4284563ac6c8d02b5416&,
333909848762744832,potiii,2024-04-08T08:23:20.7050000+01:00,Way too much weight on the rods the base plate needs to be in the front,,
333909848762744832,potiii,2024-04-08T08:24:13.8120000+01:00,Not very safe for multiple reasons,,
236940575411011585,oreoliveson,2024-04-08T08:48:25.8360000+01:00,Zv-e1 used for professional use,https://cdn.discordapp.com/attachments/1224713323409313872/1226800809531150336/20240408_104112.jpg?ex=6853c0c9&is=68526f49&hm=042921165826b7005478bd1f9baf1b18a7d656413586d1dab395d6e789ab4fb9&,
435459109488295961,theolly,2024-04-08T11:04:04.3780000+01:00,"Love it, great lens and such a versatile range!",,
447860414089527296,godofmonkeys,2024-04-09T00:04:34.9420000+01:00,teleprompter?,,
236940575411011585,oreoliveson,2024-04-09T06:49:02.8070000+01:00,Yes,,
236940575411011585,oreoliveson,2024-04-09T09:30:57.6390000+01:00,The cameras,https://cdn.discordapp.com/attachments/1224713323409313872/1227173900199268352/20240409_112851.mp4?ex=6853cac1&is=68527941&hm=dd49a258b10329fa4e1fcf4ba6a5fffbc911ea43d4ec95770c78ac7e47804171&,
413494385351852033,sethcopela,2024-04-11T06:29:45.5100000+01:00,Love it,,
236940575411011585,oreoliveson,2024-04-12T10:48:16.5490000+01:00,"Zv-e1 with this lens, works well",https://cdn.discordapp.com/attachments/1224713323409313872/1228280520769671178/IMG_1790.jpg?ex=6853dce0&is=68528b60&hm=e35432d90ac007bf41e81a7bf299c848cc54655c737eb6cc9cf498759fb59c72&,🔥 (6)
413494385351852033,sethcopela,2024-04-12T11:45:57.8370000+01:00,nice,,
333909848762744832,potiii,2024-04-12T15:45:18.4870000+01:00,,https://cdn.discordapp.com/attachments/1224713323409313872/1228355271261163651/4FAAF2EA-A8EE-4E8E-8D0F-643A97A08B5C.jpg?ex=685379be&is=6852283e&hm=258cb4969ea0e4e13d1b1b229c5e2a0afeffbe19f0f330499c56197091271bcf&,PES_InterestedPoggers (5)
738497864258289744,dorito_082905,2024-04-15T03:45:11.9150000+01:00,are those sony mount batteries? an alternate for vmount?,,
1122989053806137386,kaijg.05,2024-04-15T04:06:25.4500000+01:00,Two npf970s on a v mount adapter. I've got over a dozen of them for my studio lights which I wasn't using this shoot,,
1122989053806137386,kaijg.05,2024-04-15T04:07:08.4690000+01:00,"Very nice, bet it works real well",,
1122989053806137386,kaijg.05,2024-04-15T04:07:54.4610000+01:00,Anything for the shot,,
738497864258289744,dorito_082905,2024-04-15T05:21:24.2340000+01:00,those are wayyyy cheaper than a regular vmount battery,,
1122989053806137386,kaijg.05,2024-04-15T05:29:26.6630000+01:00,"They are unless you're buying oem. I've got both v mounts and npfs, the v mounts are nice for convenience on the rig, but I like the npfs better overall",,
333909848762744832,potiii,2024-04-15T11:00:10.9740000+01:00,"Yush. Ifootage arms are very strong it seems, didnt have any problem w that rig",,
333909848762744832,potiii,2024-04-15T11:00:58.5550000+01:00,But its better be safe than sorry so now after a few days of shoot w that im gonna wait out the supply plate and the L bracket before i take an L myself,,
333909848762744832,potiii,2024-04-15T11:01:12.1500000+01:00,Until than ill just use the rig w no gimbal.,,
333909848762744832,potiii,2024-04-15T14:14:34.7930000+01:00,How is it not front heavy?,,
333909848762744832,potiii,2024-04-15T14:17:05.2830000+01:00,I like when it pulls back on my shoulder so I only need to counteract and I dont have to put in any effort,,
333909848762744832,potiii,2024-04-15T14:18:35.9060000+01:00,"It seems to me that even w a battery attached yours will be very front heavy. This is why i was planning to attach a dovetail plate on the shoulder rig so i can shift the weight back and forward deepends on my setup , battery and lens choices",,
721686599317979136,marlow925,2024-04-15T15:30:59.3190000+01:00,"I don't use a monitor/recorder. I use an EVF. The whole monitor setup is usually, what loads extra weight on the front.",,
721686599317979136,marlow925,2024-04-15T15:31:38.9470000+01:00,"Also, I don't only have a V-mount on the back, but also the TX from the DJI Transmission system.",,
721686599317979136,marlow925,2024-04-15T15:32:03.3440000+01:00,"So there's a good bit more kit on the back usually, that's not mounted right now.",,
333909848762744832,potiii,2024-04-15T15:45:54.1840000+01:00,Oh i see! That makes sense now,,
1122989053806137386,kaijg.05,2024-04-15T18:41:18.6830000+01:00,"Probably best, but I love haphazard rigs",,
1122989053806137386,kaijg.05,2024-04-15T18:44:07.4910000+01:00,"Its still not front heavy? Even with that, I'd guess it still puts a lot of weight on ur hands w the servos and lens",,
333909848762744832,potiii,2024-04-15T19:06:35.7570000+01:00,Well the back is attached w a magic arm and on the front there is a nato smallrig monitor mount connecting it to rods that are only attached from the back baseplate and nothing is holding them in the front. The magic arm SHOULD be strong enough by its own but ofc the force acting on the lever arm is crazy here since it holds the gimbal from the back . Reversing the monitor mount and the magic arm should give it a better chance to not break. Also unscrewing the rod plate and placing it on the middle.,,
333909848762744832,potiii,2024-04-15T19:07:31.1950000+01:00,"But ill just rather wait for the plates, dovetail so i can adjust it , powersupply and ill get the new smallrig 212 V mount for it and the L bracket",,
1122989053806137386,kaijg.05,2024-04-15T19:15:47.1650000+01:00,"If it's got smth bracing it near the front, it's not too much force on the magic arm at all, so it shouldn't go amywhere... but it's a lot of gear to risk for a ""shouldn't""",,
333909848762744832,potiii,2024-04-15T19:18:56.9120000+01:00,"Yup that was my thinking too , but the thing on the front is a shitty monitor mount 😂. In theory it should hold no matter how weak it is , it just need another point of contact. But yes Im wont really risk this on an “it should hold “ 😂",,
641009845696200746,vwmk7.5,2024-04-16T01:23:08.8670000+01:00,💀,https://cdn.discordapp.com/attachments/1224713323409313872/1229587853021937715/IMG_7843.jpg?ex=6854012c&is=6852afac&hm=ac623c7540c31dacef4b29004030d0e15e8908e387126783ce59543a669e6e12&,
413494385351852033,sethcopela,2024-04-16T01:37:41.9580000+01:00,Lmao,,
630097135362113536,david.noh,2024-04-16T03:13:36.7460000+01:00,ah yess stablized lighting,,
641009845696200746,vwmk7.5,2024-04-16T09:35:31.0540000+01:00,Of course,,
